{
  "schema_version": 1,
  "deployment_id": "kingston-like",
  "community": {
    "name": "Kingston Test Community",
    "locality": "Kingston",
    "region": "Ontario",
    "country": "CA"
  },
  "site_name": "Kingston Fixture Food Help",
  "short_name": "Food Help",
  "description": "A fictional demonstration of a local food-access directory. These example services do not exist.",
  "language": "en",
  "locale": "en-CA",
  "text_direction": "ltr",
  "time_zone": "America/Toronto",
  "canonical_origin": "https://kingston-fixture.example.invalid",
  "operator": {
    "name": "Example Community Volunteers",
    "statement": "A fictional community directory demonstrating Food Help."
  },
  "corrections": {
    "email": "corrections@example.invalid"
  },
  "help_contact": {
    "label": "Call 2-1-1",
    "phone": "211"
  },
  "emergency_contact": null,
  "review": {
    "interval_days": 30
  },
  "location": {
    "enabled": true
  },
  "indexing": {
    "enabled": false
  },
  "analytics": {
    "enabled": false
  },
  "public_usage": {
    "enabled": false
  },
  "example_content": true,
  "data_rights": {
    "statement": "Fictional example data created for Food Help; dedicated to the public domain under CC0.",
    "license": "CC0-1.0",
    "url": "https://creativecommons.org/publicdomain/zero/1.0/"
  }
}
